title,source_document_url,type,uuid,language,published_at,evaluation_type,sector,series,series_number,datainnsamling 1,datainnsamling 2,datainnsamling 3,datainnsamling 4,datainnsamling 5,method,length
Lokal forvaltning av villaksressursene,,Evaluering,6b790364-72c7-4e52-8267-3fad6f5f58a7,nob,2006,Etterevaluering,Miljø,NINA rapport,107,Intervju,Spørreskjema,,,,,148874
Kompetanseutvikling drift og vedlikehold,,Evaluering,6b7b389c-d8af-4646-b204-b7276eacdaa2,nob,2012,Tidsuavhengig evaluering,Transport og kommunikasjon,VD rapport,59,,,,,,,65746
Regionforstørring,,Evaluering,6b7c0ee2-5a6f-4ddb-8783-a4dfe7738582,nob,2010,Etterevaluering,Transport og kommunikasjon,TØI-rapport,1057/2010,Intervju,Dokumentstudier,Statistikk,,,,286052
Personvern og ITS-baserte trafikksikkerhetstiltak,,Evaluering,6b7edcb5-e2ce-471c-9758-ce0e552f5ad7,nob,2010,Tidsuavhengig evaluering,Transport og kommunikasjon,TØI-rapport,1097/2010,Intervju,Dokumentstudier,,,,,296447
Arbeidsgivers plikt til å gjennomgå HMS-opplæring,,Evaluering,6b82b399-14c4-4eac-b1a7-da534df4f38a,nob,2011,Tidsuavhengig evaluering,Arbeid og velferd,Fafo-rapport,2011:29:00,Intervju,Spørreskjema,Dokumentstudier,,,,208260
PFOA in Norway,,Evaluering,6b937952-4620-4bba-acbc-02c4acae50c0,eng,2008,Tidsuavhengig evaluering,Miljø,,,Dokumentstudier,Observasjon,,,,,171244
Et arbeidsliv for alle : arbeidsdeltakelse og funksjonshemmede,,Evaluering,6b9cbde6-41a3-481b-b3f3-b3a1c720d180,nob,2011,Tidsuavhengig evaluering,Arbeid og velferd,FFOs skriftserie,02.nov,Dokumentstudier,Statistikk,,,,,205027
Verdiskapingsanalyse av reiselivsnæringen i Norge,,Evaluering,6baf2f68-83e0-4f55-81b7-1b8117bbed25,nob,2015,Tidsuavhengig evaluering,Næringsliv,,,Dokumentstudier,Statistikk,,,,,373490
"""Næringslivets avstandskostnader"" - et fruktbart begrep?",,Evaluering,6be24f9e-7b0a-4087-bd9f-d46b185b0641,nob,2008,Samfunnsøkonomisk analyse,Transport og kommunikasjon,TØI-rapport,956/2008,Dokumentstudier,,,,,,132074
Evaluering,,Evaluering,6c068e0e-7cb2-4284-a6c3-c82473bd771f,nob,2013,Underveisevaluering,Likestilling,,,Spørreskjema,Dokumentstudier,,,,,164732
Kvalitetssikring av Konseptuell løsning (KL) for prosjekt 3049 Erstatning av Nordkapp-klassen,,Evaluering,6c0b82fe-a6b8-478b-819d-f47927d7e76c,nob,2015,Tidsuavhengig evaluering,Samfunnssikkerhet,Rapport,2015/38,Dokumentstudier,Statistikk,,,,,216999
Utredning av kostnader for økt krafttilgang i Midt-Norge,,Evaluering,6c232bd9-c583-41bc-8800-b618ca0a7ce0,nob,2008,Forhåndsevaluering,Energi,Econ-rapport,123,Intervju,Dokumentstudier,,,,,90374
"Biologisk evaluering av tilskuddsordningen for forvaltning av kortnebbgjess i Nord-Trøndelag, våren 2009",,Evaluering,6c4375cc-d285-4cd3-8725-66156c527467,nob,2010,Etterevaluering,Miljø,NINA rapport,540,Statistikk,Observasjon,,,,,37339
Utredning av kvalifikasjonskrav i bygge- og anleggsbransjen,,Evaluering,6c46f9e4-a428-4942-b66d-295a276b6e95,nob,2021,Samfunnsøkonomisk analyse,Bolig og eiendom,,,Intervju,Dokumentstudier,Statistikk,,,,273263
Review of Norwegian support to the Global Alliance for Clean Cookstoves 2010-2017,,Evaluering,6c5fed46-ceb3-43ff-9cd8-791012d49efd,eng,2018,Underveisevaluering,Energi,Norad Collected Reviews,mai.18,Intervju,Dokumentstudier,Observasjon,,,,264117
Evaluering av Kvinner i Fokus og Nettverkskreditt,,Evaluering,6c69a7c8-f3fc-4997-aa32-24f0f7b74728,nob,2008,Underveisevaluering,Næringsliv,,,Spørreskjema,Dokumentstudier,,,,,272958
Erfaringer fra ordningen med regionale verneombud,,Evaluering,6c789bfb-1e47-4eab-a738-e6c92e18480e,nob,2007,Tidsuavhengig evaluering,Arbeid og velferd,Econ-rapport,94/2007,Intervju,Spørreskjema,Dokumentstudier,,,,215168
Support to Legislatures,https://www.norad.no/om-bistand/publikasjon/2010/support-to-legislatures/,Evaluering,6ca263d2-39f7-4ce8-8e9f-9929b331a16f,eng,2010,Etterevaluering,Internasjonalt,Rapport,feb.10,Intervju,Dokumentstudier,Statistikk,,,,370898
Evaluering av OPS i vegsektoren,,Evaluering,6caaefd4-5269-4be1-a99b-1c3ca1f69d76,nob,2007,Etterevaluering,Transport og kommunikasjon,TØI-rapport,890/2007,Intervju,Spørreskjema,Dokumentstudier,,,"Det er benyttet ulike metoder, hovedsakelig ikke-tilfeldig utvalgte respondenter. ",165264
Konseptvalgsutredninger og samfunnsøkonomiske analyser,,Evaluering,6ccf7b2e-3f27-4531-ad6b-53ae2ed48f1c,nob,2011,Samfunnsøkonomisk analyse,Transport og kommunikasjon,TØI-rapport,1011/2009,Spørreskjema,,,,,,507555
Risk of Combination Effects Between Decabromodiphenyl Ether and Other Polybrominated Diphenyl Ethers,,Evaluering,6ccf8074-f4b3-4513-a25d-937220ce7f75,eng,2013,Underveisevaluering,Miljø,Rapport,M-223,Dokumentstudier,Observasjon,,,,,411806
Flere flyktninger bosatt raskere,,Evaluering,6d01ad6e-fec8-490d-b0b0-3cbbadac0db3,nob,2018,Etterevaluering,Kommuner og distrikter,NIBR-rapport,2018:03:00,Intervju,Spørreskjema,Dokumentstudier,Statistikk,,,242591
Likestilling i transport,,Evaluering,6d0f008b-746c-465f-83dc-e21aa9f700f9,nob,2006,Tidsuavhengig evaluering,Transport og kommunikasjon,TØI-rapport,866/2006,Dokumentstudier,,,,,,150274
Samfunnsøkonomisk analyse av utdyping i Sørvær fiskerihavn,,Forhåndsutredning,6d1acd99-6844-4869-9af0-54ff37661bc8,nob,2016,Samfunnsøkonomisk analyse,"Mat, fisk og landbruk",,,Intervju,Statistikk,,,,,111765
Ressursgjennomgang av Lotteri- og stiftelsestilsynet,,Evaluering,6d1faf8e-ee13-4ea1-82d8-8a010693650d,nob,2010,Tidsuavhengig evaluering,"Kultur, fritid og livssyn",,,Intervju,Dokumentstudier,,,,,NULL
Eldres transportvirkelighet 2030,,Evaluering,6d4de3f9-7198-4973-a1e7-b7a6f20b005c,nob,2011,Forhåndsevaluering,Transport og kommunikasjon,Econ-rapport,R-2011-051,Spørreskjema,Dokumentstudier,Statistikk,,,,292256
Energize Nepal 2016-2019,,Evaluering,6d506d5e-993a-4390-978d-730a450a554e,eng,2020,Underveisevaluering,Energi,Norad Collected Reviews,okt.19,Intervju,Dokumentstudier,Observasjon,,,,NULL
Nye samarbeidsformer - nye læringsformer?,,Evaluering,6d589039-3bf9-458d-aa0b-facf12d8c1ca,nob,2011,Underveisevaluering,Arbeid og velferd,NF-rapport,jul.11,Intervju,Spørreskjema,Dokumentstudier,,,Tilfeldig utvalgsmetode. Personlige- og telefonintervju. ,288025
On equal terms?,,Evaluering,6d706e52-7979-495a-9698-e621e5e2d2b7,nob,2009,Underveisevaluering,Innvandring og inkludering,Fafo-rapport,2009:29:00,Intervju,Statistikk,,,,,333294
Use of Evaluations in Norwegian Development Cooperation System,,Evaluering,6d75d43d-1b21-48a5-984a-773b988bd6f1,eng,2013,Etterevaluering,Internasjonalt,Evalueringsrapport,aug.12,Intervju,Spørreskjema,Dokumentstudier,,,,236482
EU’s rammedirektiv for vann,,Evaluering,6da2d80b-ebac-47fb-930a-9c7ccfc691c0,nob,2008,Underveisevaluering,Miljø,,,Dokumentstudier,Observasjon,,,,,55403
Oppbevaring av norsk radioaktivt avfall,,KVU/KS1/KS2,6db697ac-aa22-4808-a629-eec754ddfade,nob,2015,Forhåndsevaluering,Miljø,,,,,,,,,578249
Næringslivets syn på Skatteetaten 2009,,Evaluering,6dc38051-ddb0-4f37-b666-f35e43fa8e90,nob,2009,Tidsuavhengig evaluering,Økonomi,,,Intervju,,,,,,76058
Innvandrere og sysselsetting i et regionalt perspektiv,,Evaluering,6dc67adc-9a78-458e-b545-2fa50240a91e,nob,2015,Samfunnsøkonomisk analyse,Kommuner og distrikter,NIBR-rapport,2014:25:00,Dokumentstudier,Statistikk,,,,,257570
Kvalitetssikring av fasiliteter for Tromsø Museum - Universitetsmuseet,,Evaluering,6dda9b54-007e-48c2-9d56-6129efd3af5c,nob,2015,Etterevaluering,"Kultur, fritid og livssyn",,,Statistikk,,,,,,294391
Elbileiernes reisevaner,,Evaluering,6dde4281-a5c1-4e1d-ae22-3279628630e4,nob,2006,Tidsuavhengig evaluering,Transport og kommunikasjon,Econ-rapport,2006-040,Spørreskjema,Statistikk,,,,,70003
Riksrevisjonens undersøkelse av styring av pleieressursene i helseforetakene,,Riksrevisjonsrapport,6dea550b-429e-4436-a7cd-75523a156342,nob,2015,Tidsuavhengig evaluering,Konstitusjonelle organer ,Dokument,3:12 (2014-2015),Intervju,Spørreskjema,Dokumentstudier,Statistikk,,,151467
Generelle og prosjektspesifikke trafikkprognoser,,Evaluering,6e040501-a491-4bf0-af44-c9ec13d6a6b8,nob,2005,Tidsuavhengig evaluering,Transport og kommunikasjon,Rapport,512,,,,,,Drøfting,90935
Publikumsundersøkelse 2006,,Evaluering,6e63d787-868c-46c6-9e3b-75df9cafd7fb,nob,2006,Underveisevaluering,Lov og rett,,,Intervju,Spørreskjema,,,,,123040
Evaluering av Husbankens innsats i Groruddalen,,Evaluering,6e783143-0370-43e9-a588-cb1e1eb33c83,nob,2011,Etterevaluering,Bolig og eiendom,,,Intervju,Dokumentstudier,,,,,176701
En satsing for fremtiden,,Evaluering,6e9cba93-b080-4a38-9666-0add6ba7e655,nob,2010,Etterevaluering,Utdanning og forskning,,,Dokumentstudier,Statistikk,,,,,195287
"A comparison of master degrees in Norway and the UK, with focus on recognition ",,Evaluering,6ea8603f-51f3-4608-a209-f253f21f80ec,nob,2006,Etterevaluering,Utdanning og forskning,NOKUTs rapporter,,Dokumentstudier,,,,,,144535
Vurdering av forbud mot fossilt brensel i landbruksbygg mv.,,Evaluering,6eaa0d4d-9a9a-4a58-845a-08f59ca1a786,nob,2016,Forhåndsevaluering,Bolig og eiendom,Rapport,2016/34,Intervju,Dokumentstudier,,,,,48220
Helhetlig oppfølging av lavinntektsfamilier,,Evaluering,6eb1ae5b-463c-4533-8c86-5ee9bd4ea214,nob,2019,Underveisevaluering,Arbeid og velferd,OsloMet skriftserie,okt.19,Intervju,Spørreskjema,Statistikk,Observasjon,,klynge-randomisert studie med prosessevaluering,563324
"Mobilisering, kapasitetsløft og dialog:  Forventede resultater og effekter av Forskningsrådets FORREGION-program på innovasjonssystemenes utvikling   ",,Evaluering,6ec4ba84-4f4b-40a2-a3fe-4a829928efe4,nob,2019,Underveisevaluering,Utdanning og forskning,,,Intervju,Dokumentstudier,Observasjon,,,,400477
Planlegging og forvaltning av urbane friluftsområder i Kristiansand,,Evaluering,6eee5ca6-3145-45bb-83b1-8494c84bf778,nob,2008,Tidsuavhengig evaluering,"Kultur, fritid og livssyn",,,Intervju,Spørreskjema,Dokumentstudier,Statistikk,Observasjon,,303180
Integrasjon av kommunale utleieboliger i borettslag og boligbyggelag i Bergen - en undersøkelse av boforhold og bokvalitet og en evaluering salg av boliger til boligbyggelagene,,Evaluering,6f086937-2035-4038-8465-22d09bedf016,nob,2004,Etterevaluering,Bolig og eiendom,,,Spørreskjema,Dokumentstudier,,,,,204529
"Innovativ rehabilitering i Indre Østfold, nasjonalt forsøk med kommunal rehabilitering",,Evaluering,6f38c6ce-50ec-4432-aa0c-ea1a86600b70,nob,2021,Underveisevaluering,Helse og omsorg,,,Intervju,Spørreskjema,Dokumentstudier,Statistikk,Observasjon,,166501
Bostøtte og økonomisk sosialhjelp,,Evaluering,6f50e622-77b6-45be-a8be-56722342e7a4,nob,2012,Tidsuavhengig evaluering,Økonomi,,,Dokumentstudier,Statistikk,,,,,23050
Evalueringsrapport II,,Evaluering,6f68da74-e158-4ce9-ada8-a88ed43633d3,nob,2008,Etterevaluering,Helse og omsorg,,,Spørreskjema,,,,,,101446
Riksrevisjonens undersøkelse av skatteoppkrevernes stedlige arbeidsgiverkontroll,,Riksrevisjonsrapport,6f78a770-8f82-430a-be18-2ec952eac40e,nob,2001,Tidsuavhengig evaluering,Konstitusjonelle organer ,Dokument,3:5 (2001-2002),Spørreskjema,Dokumentstudier,Statistikk,,,,134539
Refleksjon som metode i barnehagers språkarbeid,,Evaluering,6f9eca4f-86ff-4e74-a870-66c590eaeb62,nob,2014,Underveisevaluering,Utdanning og forskning,Fafo-rapport,2014:24:00,Intervju,Observasjon,,,,,205257
Festivalkommuner,,Evaluering,6fa9910b-d79d-47b6-a1b0-7e0b15d84f16,nob,2012,Samfunnsøkonomisk analyse,"Kultur, fritid og livssyn",NIBR-rapport,2012:07:00,Intervju,Dokumentstudier,,,,,217018
Duoji ovdáneami ekonomiijaraporta,,Evaluering,6fb2f153-8aa3-4aaf-a42b-18b926ddc1b2,sme,2010,Etterevaluering,Næringsliv,,,Spørreskjema,,,,,,21235
Evaluering av samordningsforsøkene,,Evaluering,6ff96496-240e-4625-9d5c-56c9126d41c9,nob,2005,Tidsuavhengig evaluering,Arbeid og velferd,Arbeidsrapport,mai.05,Spørreskjema,,,,,Tilfeldig utvalgsmetode. ,306350
Innvandrerne som skulle klare seg selv,,Evaluering,7039f9ad-39da-43c1-a745-cfbb9d094b42,nob,2013,Underveisevaluering,Arbeid og velferd,Fafo-rapport,2013:31:00,Intervju,,,,,Personlige intervju,221138
Effects of intraday trade on NorNed,,Evaluering,705ce450-7bd8-41ad-8e58-f4c3c6d26a80,eng,2011,Samfunnsøkonomisk analyse,Energi,Econ-rapport,2011-005,Intervju,Statistikk,,,,,217500
Vern eller bruk av skog som klimatiltak ,,Evaluering,70775435-f187-4e79-b144-da9cb2fc13b3,nob,2016,Forhåndsevaluering,Miljø,Rapport / Miljødirektoratet,M-519,Intervju,Dokumentstudier,,,,,50895
Riksrevisjonens undersøkelse av inntektssystemet for kommunene,,Riksrevisjonsrapport,707a5fd7-5664-4c05-a536-49e9048905fd,nob,2003,Tidsuavhengig evaluering,Konstitusjonelle organer ,Dokument,3:8 (2002-2003),Dokumentstudier,Statistikk,,,,,218312
Bedrifters møte med kompetansemegling i FORREGION,,Evaluering,7098daeb-08ee-4cd1-990a-fcde8f373514,nob,2019,Underveisevaluering,Utdanning og forskning,,,Intervju,,,,,,47017
"Mid-Term Evaluation of the Joint Donor Team in Juba, Sudan",,Evaluering,709badc0-8143-4ea2-b8a3-2c975661c974,eng,2008,Etterevaluering,Internasjonalt,Evalueringsrapport,feb.09,Intervju,Spørreskjema,Dokumentstudier,,,,246734
Country Evaluation Brief: Somalia,,Evaluering,70a97210-39ac-4b46-9222-1197ac519dbb,eng,2017,Etterevaluering,Internasjonalt,Rapport,mar.17,Dokumentstudier,,,,,,72824
Vend om i tide : en evaluering av SNU-prosjektene i Trondheim og Bergen. Det er ingen skam å snu,,Evaluering,70aa8183-4340-4923-95a2-a66f116fbacf,nob,2006,Underveisevaluering,Offentlig forvaltning,KRUS dokumentasjon & debatt,mar.06,Intervju,Observasjon,,,,,404117
Evaluering av Kompetanseutviklingsprogrammet,,Evaluering,70acbabf-a1cb-473f-aefe-b85a92cea8f8,nob,2002,Tidsuavhengig evaluering,Utdanning og forskning,Arbeidsnotat,24/2002,Intervju,Spørreskjema,Dokumentstudier,,,,188021
Likestilte politikere?,,Evaluering,70be72c2-46af-468d-b299-79f6613f91df,nob,2005,Tidsuavhengig evaluering,Likestilling,NIBR-rapport,2005:18:00,Spørreskjema,Statistikk,,,,"Data er hentet fra ulike datakilder. Hovedkilden er to surveyer av lokale folkevalgte som ble valgt inn i henholdsvis 1999 og 2003. Offisiell statistikk hentet fra kommunedatabasen til Norsk samfunnsvitenskapelig datatjeneste. I tillegg er data om listekandidatene ved kommunestyrevalgene i 2003 benyttet. Analysene av representantene baserer seg på de to surveyundersøkelsene, som ble utført i forbindelse med en undersøkelse av unge folkevalgte (Berglund og Winsvold 2005). Det ble foretatt intervjuer av to kull av folkevalgte – det som ble valgt inn for perioden 1999- 2003-kullet og det som ble valgt for perioden 2003-2007. Alle som var 30 eller yngre da de ble innvalgt ble kontaktet. I tillegg ble et utvalg av folkevalgte som var eldre enn tretti år da de ble innvalgt kontaktet. Bi-, multivariat- og regresjonsanalyse.",180862
Eldres boligsituasjon,,Evaluering,70d1a4d6-75db-45de-b6dc-061c6ddd5fa3,nob,2016,Underveisevaluering,Bolig og eiendom,NOVA-rapport,nov.16,Spørreskjema,Dokumentstudier,Statistikk,,,,455960
På sporet av kjønnsperspektivet,,Evaluering,70d3a62d-4796-4fe7-b9c9-67e095606d60,nob,2009,Etterevaluering,Likestilling,,,Intervju,Spørreskjema,Dokumentstudier,,,Kvalitativ og kvantitativ innholdsanalyse,111068
Riksrevisjonens undersøkelse av ivaretakelse av veteraner fra internasjonale operasjoner,,Riksrevisjonsrapport,70f915c8-dc81-4e1e-9cfb-c1d6ca60a14c,nob,2014,Tidsuavhengig evaluering,Konstitusjonelle organer ,Dokument,3:9/(2013-2014),Intervju,Dokumentstudier,Statistikk,,,,412191
Evaluering av Nasjonalt geriatriprogram,,Evaluering,7118d1e2-6ea9-4749-95e2-1449b0d2d308,nob,1999,Etterevaluering,Helse og omsorg,,,Intervju,Dokumentstudier,,,,"Det er benyttet konsensusgrupper som uavhengig av hverandre har vurdert programmets mål, strategi og resultatoppnåelse. ",97497
FoU-strategi ved statlige høgskoler,,Evaluering,7127b7d2-0aaa-4551-9259-07726abf2df5,nob,2008,Underveisevaluering,Utdanning og forskning,Rapport,des.08,Dokumentstudier,,,,,,198027
"Evalueringsrapport: kroppsøving, årsstudieum ved HiNT",,Evaluering,7137bad9-c7a5-4b2c-895c-997c6004637a,nob,2008,Underveisevaluering,Utdanning og forskning,,,,,,,,"Samtaler og dokumentstudie, høgskolens sjekkliste",NULL
To år med regionale forskningsfond: Rapport fra følgeevalueringen,,Evaluering,714e87dc-6d46-45dd-82f8-e8a3c3c3d3fd,nob,2012,Underveisevaluering,Utdanning og forskning,Rapport,jan.12,Intervju,Dokumentstudier,Observasjon,,,,282565
"""Det tenner en gnist""",,Evaluering,714eeafd-e0df-4e49-a771-faee2aa61ffd,nob,2015,Etterevaluering,Utdanning og forskning,NOVA-rapport,feb.15,Intervju,Spørreskjema,Dokumentstudier,Statistikk,,Kvanitative og kvalitative metoder,276538
Resultatmåling av brukerstyrt forskning 2009,,Evaluering,7163d334-f88e-4ea9-8dca-cda2ab8ec282,nob,2011,Underveisevaluering,Utdanning og forskning,Rapport,1102,,,,,,,262644
Forslag til scenarioer relatert til akutt utslipp til sjø fra petroleumsvirksomhet i Nordsjøen og Skagerrak i perioden 2010 til 2030,,Evaluering,716cf8f3-0ad3-4905-9d9c-3ae9aa7a1203,nob,2012,Underveisevaluering,Offentlig forvaltning,,,Dokumentstudier,Statistikk,Observasjon,,,Metoden er utviklet i Ptil i samarbeid med konsulent og er knyttet til prinsippene i Norsk Standard for Risikostyring - Prinsipper og retningslinjer,213832
"Prosjekt til fordypning, 2008",https://www.udir.no/tall-og-forskning/finn-forskning/rapporter/prosjekt-til-fordypning-delrapport-1-2008/,Ukategorisert,71bcf277-b7e9-494a-a15e-6c1831b66fef,nob,2009,Underveisevaluering,Utdanning og forskning,FAFO-notat,2008:27:00,Intervju,,,,,,239563
Riksrevisjonens undersøkelse av statens satsing på elektroniske innkjøp,,Riksrevisjonsrapport,71df8c84-afa6-40ce-adbe-e46661a6b940,nob,2005,Tidsuavhengig evaluering,Konstitusjonelle organer ,Dokument,3:5 (2004-2005),Intervju,Spørreskjema,Dokumentstudier,,,,111872
Real-Time Evaluation of Norway’s International Climate and Forest Initiative : Contributions to National REDD+ Processes 2007-2010,,Evaluering,71e4e931-4cc1-4c7d-afa6-80dbdc1b6654,eng,2010,Underveisevaluering,Internasjonalt,Evalueringsrapport,14/2010,Intervju,Spørreskjema,Dokumentstudier,Observasjon,,,267561
A Review of the Division of Systems Analysis of the Norwegian Defence Research Establishment (FFI),,Evaluering,71f23aec-3474-468c-8ec3-95db41b9bd3d,eng,1997,Tidsuavhengig evaluering,Forsvars- og sikkerhetspolitikk,,,Observasjon,,,,,,NULL
Rapport fra kvalitetssikring av prosjekt Konseptvalgutredning for Rv. 80 Løding – Bodø sentrum,,KVU/KS1/KS2,720f4e73-fe4a-4e97-8b15-9527497a2ed8,nob,2011,Forhåndsevaluering,Transport og kommunikasjon,,,Dokumentstudier,,,,,,130666
Building Blocks for Peace,,Evaluering,721239ee-7e96-4ede-afe8-d690c5bc8b70,eng,2014,Underveisevaluering,Internasjonalt,Evalueringsrapport,jun.14,Intervju,Dokumentstudier,Statistikk,Observasjon,,,325898
Evaluering av NANOMAT,,Evaluering,721e074c-a083-4df2-b0a5-26237e898dd3,eng,2011,Etterevaluering,Arbeid og velferd,,,Intervju,Spørreskjema,Dokumentstudier,Statistikk,,,472689
Sluttevaluering av Hedmarksmodellen,,Evaluering,722a37e4-45bc-45c4-8f3e-7e126f178ade,nob,2017,Underveisevaluering,Arbeid og velferd,Proba-rapport,2016-12,Intervju,Spørreskjema,Dokumentstudier,Observasjon,,,368046
Domstolsbehandling av saker om tilbakekall av statsborgerskap,,Evaluering,7236ced3-68b1-4df0-9f04-88cf47453fa2,nob,2018,Samfunnsøkonomisk analyse,Lov og rett,Rapport,2018/04,Statistikk,,,,,,113285
Vurderinger av årsaker og medvirkende faktorer som kan resultere i akutt utslipp til sjø fra petroleumsvirksomhet i Barentshavet og havområdene utenfor Lofoten,,Evaluering,723beea6-68ba-4c1b-941d-4d72950f74d6,nob,2010,Forhåndsevaluering,Energi,Rapport,PS-0357-RE-03,Dokumentstudier,,,,,,441756
"Evaluation of the Norwegian Programme for Development, Research and Education (NUFU) and of Norad’s Programme for Master Studies (NOMA)",,Evaluering,725d6b3e-0aa8-495b-b892-6100119da8d2,eng,2009,Etterevaluering,Internasjonalt,Evaluation Report,jul.09,Intervju,Spørreskjema,Dokumentstudier,,,,270774
Evaluering av handlingsplanen for mer entreprenørskap blant kvinner,,Evaluering,7280d5da-7f8c-496a-a93d-8ff2bd167e95,nob,2011,Underveisevaluering,Næringsliv,Rapport,20/2011,Intervju,Dokumentstudier,Statistikk,,,"Kvalitativ metode, inkl. dokumentstudier og semistrukturerte intervjuer",183074
Statlige krav til innrapportering fra frivillige organisasjoner og frivilligsentraler,,Evaluering,72831efd-fec7-4e50-b46b-74a81931a135,nob,2009,Tidsuavhengig evaluering,"Kultur, fritid og livssyn",,,Intervju,Dokumentstudier,,,,,303873
Ekstern kvalitetssikring (KS1) av KVU rv.15 Strynefjellet,,KVU/KS1/KS2,72841fd5-524d-4209-8017-d517c85f50e8,nob,2013,Forhåndsevaluering,Transport og kommunikasjon,,,Intervju,Dokumentstudier,Statistikk,,,,129611
Konseptvalgutredning Grenland,,KVU/KS1/KS2,729014aa-2035-4aab-9d7b-0970455d9d9f,nob,2010,Forhåndsevaluering,Transport og kommunikasjon,,,Dokumentstudier,Statistikk,Observasjon,,,,291990
Biologiske prosesser i sedimenter,,Evaluering,72b31c10-ed0c-4eb8-a917-2084b92d866f,nob,2006,Forhåndsevaluering,Miljø,Bioforsk rapport,1(2006)nr. 123,Dokumentstudier,Statistikk,Observasjon,,,Analysemetode,101462
Review of the Norwegian Esther Program (The FK Health Exchange program): final report,,Evaluering,72e1c7b1-ac29-43fc-aea3-5a93567e7b4e,eng,2012,Underveisevaluering,Internasjonalt,,,Intervju,Spørreskjema,Dokumentstudier,,,"Kvalitativ metode, intervjuer",115096
Calculating the real return of the Norwegian Government Pension Fund Global by alternative measures of the deflator ,,Evaluering,72e6d786-4c89-4bc1-8295-5428e0595dea,eng,2014,Samfunnsøkonomisk analyse,Økonomi,,,Dokumentstudier,Statistikk,,,,,107486
Regionale sentre for likestilling og mangfold,https://www.regjeringen.no/no/dokumenter/regionale-sentre-for-likestilling-og-man/id614482/,Ukategorisert,72f575a6-27c4-4ae9-bf0b-874d1b75d781,nob,2010,Underveisevaluering,Likestilling,AFIs rapportserie,Unumm./2010,Intervju,Observasjon,,,,,NULL
Statens institutt for forbruksforskning(SIFO) - en evaluering,,Evaluering,72f983b7-c90e-4b6f-a2ec-3fd5c9d6bfab,nob,2006,Tidsuavhengig evaluering,Forbruker,,,Intervju,Spørreskjema,Dokumentstudier,,,,147331
De små skritts vei mot mestring : rehabilitering tar tid,,Evaluering,7301fd95-ff1a-4a8b-98a1-987d67a1fff2,nob,2013,Underveisevaluering,Arbeid og velferd,Prosjektrapport / Agderforskning,sep.13,Intervju,,,,,Intervjuguide med åpne spørsmål,74181
"Evaluering av NHO Buskerud sitt prosjekt ""Arbeidskraft uten merkelapp""",,Evaluering,7314dd52-6198-419e-990b-1e724588de44,nob,2012,Underveisevaluering,Arbeid og velferd,SINTEF rapport,A23087,Intervju,Dokumentstudier,Observasjon,,,"Deltakende observasjon, personlige intervju, gruppeintervju, gruppesamtaler",117739
"Kartlegging av tetrakloreten (""PER"") i avfallsstrømmen fra renseribransjen",,Evaluering,732f7323-b386-4c79-a091-78bce26923cb,nob,2009,Underveisevaluering,Miljø,,,Dokumentstudier,Observasjon,,,,,52426
"Norsk deltakelse i ESAs frivillige programmer og støtteordningen ""Nasjonale følgemidler"" - en samfunnsøkonomisk analyse",,Evaluering,7354cc9e-c485-4df1-b7a2-c5b58a6e2629,nob,2016,Samfunnsøkonomisk analyse,Næringsliv,Rapport,2016:37:00,Intervju,Spørreskjema,Dokumentstudier,Statistikk,,,178222
Fremtidig dekommisjonering av de nukleære anleggene i Norge,,KVU/KS1/KS2,735a90b7-9995-4e2b-9248-c48c02a0c02c,nob,2015,Samfunnsøkonomisk analyse,Næringsliv,,,Intervju,,,,,"Samfunnsøkonomisk analyse, nåverdiberegninger",443725
Brukerbasert evaluering av det kommunale tjenestetilbudet for barn og unge med psykiske vansker,,Evaluering,738d95b8-3fcb-47d6-afd1-3f7505b7c744,nob,2005,Tidsuavhengig evaluering,Helse og omsorg,SINTEF rapport,A055005,Spørreskjema,,,,,,168409
Spørsmål til Skole-Norge høsten 2016,,Evaluering,739512c8-7958-40ea-a5c8-e2f9b69a4154,nob,2017,Underveisevaluering,Utdanning og forskning,Rapport,2016:46:00,Spørreskjema,,,,,Kvantitativ metode,215585
Intervention Logic - Evaluation of the introduction of theorybased planning at RCN,,Evaluering,73dd9991-4c82-46b3-b45d-910099c9ca0d,eng,2020,Underveisevaluering,Offentlig forvaltning,,,Intervju,Spørreskjema,Dokumentstudier,,,,127392
Evaluering av ordinære arbeidsmarkedstiltak påbegynt 4. kvartal: dokumentasjon og analyse av effekter november 2005,,Evaluering,73ea9ff5-20e3-4048-bdde-411d318829a4,nob,2006,Etterevaluering,Arbeid og velferd,Rapport,27/2006,Statistikk,,,,,,244347
A Synthesis of Evaluations of Environmental Development Assistance by Multilateral Organisations,,Evaluering,7402583a-766b-439f-8d05-54a108c76f87,eng,2009,Samfunnsøkonomisk analyse,Internasjonalt,Study,feb.09,Dokumentstudier,,,,,,296280
Riksrevisjonens undersøkelse av Kripos,,Riksrevisjonsrapport,7407333b-8f38-4c19-b8d2-a51cfce4cf2f,nob,2004,Tidsuavhengig evaluering,Konstitusjonelle organer ,Dokument,3:5 (2003-2004),Intervju,Dokumentstudier,,,,,195510
"Evaluering av kampanjen ""si ifra"" i Vestfold og Aust- og Vest Agder",,Evaluering,746e6c1e-7d62-468b-a889-4df09f8be8ad,nob,2007,Etterevaluering,Transport og kommunikasjon,SINTEF rapport,A3827,Spørreskjema,,,,,Spørreundersøkelse,79975
Evaluering av TOPP,,Evaluering,74795105-9be2-4dc0-9475-b2616a400853,nob,2012,Underveisevaluering,Arbeid og velferd,Rapport,295,Intervju,Spørreskjema,,,,Hele populasjonen i prosjektet ble intervjuet. Personlige intervjuer. ,145619
Statlege selskap og føretak med sektorpolitiske mål,,Evaluering,747a9ab9-66f8-4f23-901c-c88e3ce756ac,nno,2011,Tidsuavhengig evaluering,Offentlig forvaltning,Rapport,mai.11,Intervju,Dokumentstudier,,,,"Arbeidet er bygd på studiar av dokument, supplert med intervju med representantar frå eigardepartement og frå leiinga i dei selskapa og føretaka som er med i kartlegginga.",109829
Erfaringer med bruk av lavenergi og passivhus yrkesbygg,,Evaluering,7483312c-fba7-4ca3-b732-1d40fab20850,nob,2013,Tidsuavhengig evaluering,Bolig og eiendom,,,Intervju,Spørreskjema,,,,,187449
Evaluering av Strategiske høgskoleprosjekter,,Evaluering,74944552-d882-4251-ac59-7e8eaa591be0,nob,2016,Underveisevaluering,Utdanning og forskning,Rapport,33-2016,Intervju,Spørreskjema,Dokumentstudier,,,,235856
