title,source_document_url,type,uuid,language,published_at,evaluation_type,sector,series,series_number,datainnsamling 1,datainnsamling 2,datainnsamling 3,datainnsamling 4,datainnsamling 5,method,length
Gjennomgang av Folketrygdfondets forvaltning av Statens pensjonsfond Norge,,Evaluering,53edadb6-0057-46e4-aaa3-ccc43abe14a5,nob,2014,Samfunnsøkonomisk analyse,Økonomi,,,Dokumentstudier,Statistikk,,,,,NULL
Evaluering av P1824,,Evaluering,53f352f4-c26d-4f85-a0c5-8944390d2f1a,nob,2010,Underveisevaluering,Arbeid og velferd,,,Intervju,Dokumentstudier,,,,"Eksplorative intervjuer, fokusgruppeintervju",154185
Resultatmåling av brukerstyrt forskning 2014,,Evaluering,5410e43d-5be9-4f46-b3d9-8c154c1efc70,nob,2016,Underveisevaluering,Utdanning og forskning,Rapport,1603,Spørreskjema,,,,,,200578
Purchasing Power Parity in Tradable Goods,,Evaluering,541177c1-ed53-44f8-bb00-20b39ba6d3ef,eng,2011,Samfunnsøkonomisk analyse,Økonomi,,,Dokumentstudier,Statistikk,,,,Formler,101909
Naturfaglig evaluering av Frivillig vern-områder,,Evaluering,541230de-1573-43d9-94ce-88371b4afd10,nob,2010,Etterevaluering,Miljø,NINA rapport,534,Dokumentstudier,Observasjon,,,,,NULL
"En, to ... tre? Den vanskelige overgangen : evaluering av Kunnskapsløftet",,Evaluering,543e72a8-ab08-4f90-93ec-f784b76e9ea7,nob,2010,Underveisevaluering,Utdanning og forskning,Rapport,21/2010,Statistikk,,,,,,324025
Livsopphold ved startlån,,Evaluering,544212f3-3704-4a27-a604-0ba375b51d59,nob,2012,Tidsuavhengig evaluering,Økonomi,SIFO - Oppdragsrapport ,jan.12,Dokumentstudier,Statistikk,,,,,150455
Modellene som forsvant,,Evaluering,54454acc-37ca-44c4-873d-80d44c8c1af0,nob,1996,Underveisevaluering,Helse og omsorg,,,Intervju,Dokumentstudier,,,,,81606
Et liv jeg ikke valgte,,Evaluering,54607d0b-c62d-43cd-b8d3-7c6a9d642548,nob,2009,Tidsuavhengig evaluering,Arbeid og velferd,FOU-rapport,sep.09,Intervju,,,,,Kvalitativ tilnærming (intervju) basert på datatriangulering,644514
"""Intensjon og effekt, snørr og bart""",,Evaluering,546264c9-bf52-48af-94d4-cb58b32ad706,nob,2004,Underveisevaluering,Offentlig forvaltning,,,Intervju,,,,,Intervjumetoder,104116
Riksrevisjonens undersøkelse av Forsvarets salg av F-5 jagerfly,,Riksrevisjonsrapport,546d7651-65a1-4b64-8160-217d1864b9bb,nob,2017,Etterevaluering,Forsvars- og sikkerhetspolitikk,Dokument, 3:7 (2016-2017),Intervju,Dokumentstudier,,,,,312373
Evaluering av Likestillings- og diskrimineringsombudet,,Evaluering,5474dc8e-8314-4fa9-a6cd-7c165ecb2cc8,nob,2009,Underveisevaluering,Likestilling,AFIs rapportserie,jan.09,Intervju,Dokumentstudier,Statistikk,,,Noen av intervjuene spesifiseres som landsomfattende representativ spørreundersøkelse,NULL
Vurdering av Enovas utløsende effekt,,Evaluering,5477f027-1543-4aed-8b44-afe9479e393a,nob,2010,Forhåndsevaluering,Energi,Rapport,14/2010,Dokumentstudier,,,,,,193881
Pliktige elsertifikater,,Evaluering,54822f36-b0d0-4959-927b-ad26cb907721,nob,2005,Forhåndsevaluering,Energi,Rapport,jan.05,Dokumentstudier,,,,,,99897
Riksrevisjonens undersøkelse om realisering av nytteeffekter fra IT-prosjekter i trygdeetaten,,Riksrevisjonsrapport,5486ab93-f651-4779-a399-af73b2e167b0,nob,2005,Tidsuavhengig evaluering,Konstitusjonelle organer ,Dokument,3:2 (2005-2006),Intervju,Dokumentstudier,,,,,152550
Kommunenes praksis for bruk av vilkår ved tildeling av økonomisk sosialhjelp,,Evaluering,548f8332-1c6b-4308-869b-a83ab945e699,nob,2013,Tidsuavhengig evaluering,Arbeid og velferd,,,Intervju,Spørreskjema,Dokumentstudier,Statistikk,,,185668
Riksrevisjonens undersøkelse av bistand til ren energi,,Riksrevisjonsrapport,5495ad3f-886b-4bd5-81ae-f78815bfe969,nob,2014,Tidsuavhengig evaluering,Konstitusjonelle organer ,Dokument,3:12 (2013-2014),Intervju,Spørreskjema,Dokumentstudier,Statistikk,,,272725
Riksrevisjonens oppfølging av forvaltningsrevisjonar som er behandla av Stortinget,,Riksrevisjonsrapport,54a51bf6-6223-4de2-9fc3-e7faedc8f230,nno,2014,Etterevaluering,Konstitusjonelle organer ,Dokument,3:1(2014-2015),Dokumentstudier,,,,,,128244
Energiloven og energieffektivisering,,Evaluering,54bec2e3-4043-4723-9325-cdfdc4b2db51,nob,2007,Samfunnsøkonomisk analyse,Energi,Econ-rapport,77/2007,Dokumentstudier,,,,,,246740
Hva har småkommunene fått ut av Byregionprogrammet?,,Evaluering,54c91308-ec14-4984-9996-0e1894a8bee2,nob,2020,Tidsuavhengig evaluering,Kommuner og distrikter,,,Intervju,,,,,,22183
Forsøk med ny ansvarsfordeling mellom stat og kommune på barnevernområdet : følgeevaluering,,Evaluering,54d22082-1836-42ab-93ba-95727364eaa2,nob,2019,Underveisevaluering,Familie og oppvekst,,,Intervju,Dokumentstudier,Statistikk,,,Intervju: Strategisk utvalg (informanter ble valgt ut av evaluator i dialog med kommunene) Statistikk: Tilgjengelig statistikk (SSB) og innhetet rapportering fra kommunene. Frekvensanalyser.,352399
Oppfølgingsprosjektet i Ny GIV,,Evaluering,54dddb17-8002-4d21-8cd4-3c934a1db708,nob,2015,Tidsuavhengig evaluering,Utdanning og forskning,NOVA-rapport,jan.15,Dokumentstudier,Statistikk,,,,,349369
Riksrevisjonens kontroll med forvaltningen av statlige selskaper for 2010,,Riksrevisjonsrapport,54e6c2b2-f1b9-4e52-9d2e-c44607d7449b,nob,2012,Etterevaluering,Konstitusjonelle organer ,Dokument,3:2 (2011-2012),Dokumentstudier,Observasjon,,,,,377881
Investeringer i kraftproduksjon,,Evaluering,54eaf0f4-6716-47a4-a9ff-47cde74fe257,nob,2007,Etterevaluering,Energi,,,Dokumentstudier,Observasjon,,,,,53525
Kreftrammede arbeidstakere og arbeidsnærvær,,Evaluering,54f40a32-b216-4286-9507-76848f5d72e1,nob,2015,Tidsuavhengig evaluering,Arbeid og velferd,Proba-rapport,2015-09,Intervju,Spørreskjema,Dokumentstudier,Statistikk,,,451876
Vurdering av virkemidler for økt utsortering av våtorganisk avfall og plastemballasje,,Evaluering,55223fba-8e7f-4fd7-91c0-e5e63a4ef99a,nob,2016,Underveisevaluering,Miljø,Oppdragsrapport,OR.01.16,Dokumentstudier,Observasjon,,,,,229251
"Klara Klok,  en helsenettjeneste for ungdom",,Evaluering,5529c121-bfc3-44d9-9544-adcf93083a4a,nob,2011,Tidsuavhengig evaluering,Helse og omsorg,NOVA notat,aug.11,Intervju,Spørreskjema,Dokumentstudier,,,,183254
Brukerundersøkelse 2015,,Evaluering,552ac55a-875d-46f7-8633-8e1de2365d73,nob,2016,Etterevaluering,Bolig og eiendom,,,Spørreskjema,,,,,,36435
Bedre kår for lokalidretten? Evaluering av Kultur- og kirkedepartementets tilskuddsordning til lokale idrettslag,,Evaluering,552fc57f-a645-4bce-b823-7082bb4bba7e,nob,2004,Underveisevaluering,"Kultur, fritid og livssyn",Rapport,224/2004,Intervju,,,,,"Skriftlig materiale fra et utvalg på 186 kommuner og dybdestudier av 12 kommuner. Som ledd i dybdestudien er det gjennomført intervjuer i 20 idrettslag, 11 idrettsråd og med representanter for kommunale myndigheter på politisk og administrativ side. Det er også gjennomført intervjuer i 9 av idrettskretsene, samt med representanter for Kulturdepartementet og NIF sentralt.",353146
Politiets nasjonale innbyggerundersøkelse 2009,,Evaluering,5531a639-5ecd-4b5d-a6d4-6b8b60bab846,nob,2009,Underveisevaluering,Lov og rett,,,Intervju,Spørreskjema,Statistikk,,,"CATI telefonintervju, TNS Gallups befolkningsdatabase, utvalget av personer med innvandrerbakgrunn fra ikke-vestlige land er trukket fra folkeregisteret",118049
Evaluering av NAV-reformen,,Evaluering,554202e8-5253-4f22-9797-c709090eb200,nob,2010,Underveisevaluering,Arbeid og velferd,,,Dokumentstudier,,,,,,29685
"""Velkommen inn""",,Evaluering,5546733c-aec0-42f1-bfce-6bc749ce3465,nob,2011,Underveisevaluering,Arbeid og velferd,ØF-notat,15/2011,Intervju,Observasjon,,,,Strategisk utvalgs metode. Telefon- og personlige intervjuer.,107336
Fra planlegging til ferdigstillelse av boligprosjekt,,Evaluering,558db3fb-acec-4464-bd2d-8da9e942b699,nob,2014,Etterevaluering,Bolig og eiendom,,,Intervju,Dokumentstudier,Statistikk,,,,133143
Riksrevisjonens undersøkelse vedrørende lokal lønnspolitikk i departementene og departementenes oppfølging av lokal lønnspolitikk i underliggende virksomheter,,Riksrevisjonsrapport,55910aec-6c0a-43b0-aef9-060ca336be09,nob,1999,Tidsuavhengig evaluering,Konstitusjonelle organer ,Dokument,3:4 (1999-2000),Intervju,Dokumentstudier,,,,,228702
Kostnadsvurderinger - nedgravde avfallsløsninger,,Evaluering,55987468-f93c-4f4c-bef4-52a60b9e3c4c,nob,2013,Underveisevaluering,Miljø,,,Dokumentstudier,Observasjon,,,,,64322
Árvvoštallat gealboguovddáža dárbbu meahcástanealáhusaid várás,,Evaluering,559efa61-7401-4317-8a9e-e1752c4b9296,sme,2009,Forhåndsevaluering,Næringsliv,,,Dokumentstudier,Observasjon,,,,,178796
Vil tiltakene virke?,,Evaluering,561575ad-ef04-4dd2-b89c-6d3afd9f3d26,nob,2012,Forhåndsevaluering,Offentlig forvaltning,Fafo-rapport,59/2012,Intervju,Spørreskjema,Dokumentstudier,Statistikk,,,286781
Lønnstakere og pensjonisters bruk og oppfatning av leveringsfritaket 2008 og 2009 ,,Evaluering,5633bdc7-1d07-4a1d-b0af-f71f4afb8f71,nob,2009,Underveisevaluering,Økonomi,,,Intervju,,,,,,58148
Videre analyser av samfunnsøkonomisk nytte av tilskudd til etterinstallering av heis,,Evaluering,5639ac46-ef00-4b89-a478-955b44376c83,nob,2016,Samfunnsøkonomisk analyse,Bolig og eiendom,,,Spørreskjema,Dokumentstudier,Statistikk,,,,85272
"Fjorden, byen og operaen",,Evaluering,563d223b-21d9-460a-a131-15591d06bd9d,nob,2012,Etterevaluering,"Kultur, fritid og livssyn",Concept rapport,28,Intervju,Dokumentstudier,Observasjon,,,,354427
Evaluering av den nasjonale rektorutdannningen 2015-2019. Delrapport 2,,Evaluering,565f8773-d0ba-4155-b540-4117aba287a5,nob,2018,Underveisevaluering,Utdanning og forskning,,,Spørreskjema,Dokumentstudier,,,,,289946
Riksrevisjonens undersøkelse av effekten store investeringer i jernbanen har på togtilbudet,,Riksrevisjonsrapport,5675514c-1eb0-4feb-ab88-10f4cd0f5b9f,nob,2017,Etterevaluering,Transport og kommunikasjon,Dokument, 3:11 (2016-2017),Intervju,Dokumentstudier,Statistikk,,,,217275
"Evaluering av tobakkskampanjen ""Røyken tar pusten fra deg""",,Evaluering,56acf2e3-41d4-4cf2-b1f2-d4f51c09149f,nob,2006,Underveisevaluering,Helse og omsorg,SIRUS skrifter,mar.06,Intervju,,,,,,167634
Arbeidsinkludering og arbeidsmotivasjon i et komparativt perspektiv,,Evaluering,56b38885-4d39-4dda-aef3-aa932496ae39,nob,2012,Tidsuavhengig evaluering,Arbeid og velferd,,,Dokumentstudier,Statistikk,,,,,71288
De frivillige hjelpeorganisasjonenes utprøving av Nødnett,,Evaluering,56d00839-b8e5-4572-8dec-370c1bbe4100,nob,2012,Etterevaluering,Samfunnssikkerhet,,,Intervju,Spørreskjema,Dokumentstudier,Statistikk,,,51225
Kompetanseløft for støttekontaktordningen,,Evaluering,56e34414-cd38-48bc-b105-9ae428677614,nob,2007,Tidsuavhengig evaluering,Arbeid og velferd,NF-rapport,jul.07,Intervju,Spørreskjema,,,,Tilfeldig utvalgsmetode. ,219396
Analyse av utviklingen i statens utgifter til fri rettshjelp og særskilte straffesaksutgifter i perioden 2008 til 2014,,Evaluering,56f7bce0-6d3d-453e-9994-7fd8da482ea9,nob,2016,Samfunnsøkonomisk analyse,Lov og rett,Menon-publikasjon,okt.16,Intervju,Statistikk,,,,"Statistisk analyse (regresjonsnalyse), teoretisk analyse, intervjuer.",179484
Benchmark av lønn- og regnskapsfunksjonen,,Evaluering,56fd008d-e8ef-44aa-aae5-047490442ccf,nob,2009,Tidsuavhengig evaluering,Økonomi,,,Statistikk,,,,,,90337
Evaluering av egenmeldingsforsøket i Kristiansand,,Evaluering,57009f7d-e797-4b81-957c-01892f99de90,nob,2005,Underveisevaluering,Arbeid og velferd,SINTEF rapport,A055011,Spørreskjema,,,,,Kvasi-eksperimentelt intervensjons-design,166388
Evaluering av FUGE,,Evaluering,57083ac8-1539-4fe9-a93b-e073d488cde1,eng,2011,Etterevaluering,Helse og omsorg,,,Intervju,Spørreskjema,Dokumentstudier,Statistikk,,,469970
Undersøkelse av vold og uønskede hendelser i asylmottak,,Evaluering,5725c436-52f3-4c83-a2f1-749b237f53b1,nob,2014,Underveisevaluering,Innvandring og inkludering,Proba-rapport,2014-08,Intervju,Spørreskjema,Dokumentstudier,Statistikk,Observasjon,,328098
Evaluering av forsøksordning med Trafikklederlos ved Kvitsøy trafikksentral (VTS),,Evaluering,573307f2-731b-4eba-8b67-5505cf7fe64c,nob,2005,Samfunnsøkonomisk analyse,Offentlig forvaltning,TØI-rapport,781/2005,Dokumentstudier,,,,,,99283
"""Kunstnerens beste venn""",,Evaluering,573594cf-38d9-4dbb-803d-31ec27edb3a9,nob,2004,Underveisevaluering,"Kultur, fritid og livssyn",,,Intervju,Dokumentstudier,,,,,161717
Verdiskapingsevnen i norske storbyregioner 2011,,Evaluering,573a9657-7a7e-49cc-95df-82b0fb54e779,nob,2011,Underveisevaluering,Næringsliv,Rapport IRIS,2011/159,Dokumentstudier,Statistikk,,,,,NULL
Evaluation of Norwegian Health Sector Support to Botswana,,Evaluering,573d25ac-5612-4117-a59f-feeff029ec6f,eng,2011,Etterevaluering,Internasjonalt,,,Intervju,Dokumentstudier,Statistikk,,,,248812
Følgeevaluering av forsøk med ny ansvarsdeling mellom stat og kommune på barnevernområdet - tredje delrapport,,Evaluering,575ece1c-f9b8-4ecf-8d30-ed03be4fee11,nob,2018,Underveisevaluering,Familie og oppvekst,,,Intervju,Dokumentstudier,Statistikk,,,Intervju: Strategisk utvalg (informanter ble valgt ut av evaluator i dialog med kommunene) Statistikk: Tilgjengelig statistikk (SSB) og innhetet rapportering fra kommunene. Frekvensanalyser.,458593
Det norske sparemarkedet: Konkurransen og effektiviteten i markedet for verdipapirfond og andre spareprodukter,,Evaluering,5794bdcf-9f5d-4964-8800-83ef254f39ef,nob,2008,Underveisevaluering,Offentlig forvaltning,,,Dokumentstudier,Statistikk,Observasjon,,,,126490
Work in Progress,,Evaluering,57975d0f-8a13-4492-98ba-004c18e0c45e,eng,2015,Etterevaluering,Internasjonalt,,,Intervju,Spørreskjema,Dokumentstudier,,,,167868
Arbeid som årsak til muskelskjelettlidelser,,Evaluering,57b14439-2ab0-41d8-917f-b70c816ccea6,nob,2008,Tidsuavhengig evaluering,Arbeid og velferd,STAMI-rapport,22/2008,Dokumentstudier,,,,,Systematisk kritisk gjennomgang av ulike undersøkelser og tidligere forskning.,245998
Riksrevisjonens undersøkelse av Norges internasjonale klima- og skogsatsing,,Riksrevisjonsrapport,57c35476-71f7-4bc9-bcfd-c82f416377a8,nob,2018,Etterevaluering,Konstitusjonelle organer ,Dokument, 3:10 (2017-2018),Intervju,Dokumentstudier,Statistikk,,,,354220
Muskxylen og muskketon i produkter i 2007,,Evaluering,57ff2c51-6e49-4662-9ee1-e77a4eec45c6,nob,2008,Underveisevaluering,Miljø,,,Dokumentstudier,Observasjon,,,,,19725
Kommunal organisering 2008,https://www.regjeringen.no/no/dokumenter/kommunal-organisering-2008/id535833/,Ukategorisert,5819d8ae-63b5-4cc4-b239-f84070132175,nob,2008,Underveisevaluering,Kommuner og distrikter,NIBR-rapport,2008:20:00,Spørreskjema,,,,,,468007
Evaluering av Kompetanse for framtidens barnehage,,Evaluering,583bb1a7-433e-403b-b9d9-97ee1a1b7160,nob,2017,Underveisevaluering,Utdanning og forskning,TFOU-rapport,2017:09:00,Intervju,Spørreskjema,Dokumentstudier,,,"Datamaterialet består av dokumentanalyser av ABLU-tilbudene, spørreundersøkelser til ABLU-studenter og TIB-studenter, casestudier i tre barnehager med ABLU-studenter og intervjuer med fylkesmannsembetene, samt data innsamlet gjennom ",306510
Suksessrike distriktskommuner,,Evaluering,585a5a16-ecb2-4934-94cb-5c05f3241fd8,nob,2012,Samfunnsøkonomisk analyse,Kommuner og distrikter,Rapport,303,Intervju,Dokumentstudier,,,,"Nettverks- og organisasjonsanalyser, fokusintervjuer",235833
Øvelse nødkommunikasjon 2010,,Evaluering,58699a4c-03d4-438c-9063-0f1ea595f7aa,nob,2010,Etterevaluering,Offentlig forvaltning,,,Spørreskjema,Observasjon,,,,,44615
Konklusjoner og erfaringer fra en evalueringsprosess,,Evaluering,586ee950-64f9-4397-a115-bf707c8827b1,nob,2002,Etterevaluering,Utdanning og forskning,,,Dokumentstudier,,,,,,59023
"No way in, no way out?",,Evaluering,58744297-1f67-45b0-a925-7720f893eb48,nob,2011,Underveisevaluering,Innvandring og inkludering,Fafo-rapport,2011:03:00,Intervju,,,,,,267427
Opptrappingsplanen for psykisk helse og forskningen,,Evaluering,5874fc41-b1cc-495e-8889-1416b8cfce78,nob,2009,Etterevaluering,Utdanning og forskning,Rapport,aug.09,Dokumentstudier,,,,,,125222
Effekter av tiltak på sykefravær,,Evaluering,5893bada-f023-48a4-bcc7-2816998cb320,nob,2008,Tidsuavhengig evaluering,Arbeid og velferd,TØI-rapport,992/2008,Dokumentstudier,,,,,Metaanalyse,87780
Kvalitet og kvantitet,,Evaluering,58acc9ec-d530-4669-9f2c-32f7fa4736d0,nob,2009,Tidsuavhengig evaluering,Helse og omsorg,NOVA-rapport,feb.09,Spørreskjema,,,,,,284783
Menighetenes samvirke med hjemmet : evalueringsforskning på trosopplæringsreformen,,Evaluering,58bba9a9-afc2-49bb-9ab7-4ab5936c2e83,nob,2012,Underveisevaluering,"Kultur, fritid og livssyn",Notat,jan.12,Intervju,Spørreskjema,Statistikk,,,"Datakilder, utforsket og analysert gjennom ulike analyseverktøy. Intervjuer og observasjoner, spørresundersøkelse foreldre og ansatte.",263239
Midterm evaluation of the NORRUSS programme,,Evaluering,58c9d03b-80a3-4e3f-97cf-8750750cf344,eng,2014,Underveisevaluering,Internasjonalt,,,Intervju,Spørreskjema,Dokumentstudier,,,,186015
"Riksrevisjonen legger fram: 1. Ekstrakt av Norges statsregnskap og regnskap for administrasjonen av Svalbard for budsjetterminen 1999, 2. Saker for desisjon av Stortinget og saker til orientering",,Riksrevisjonsrapport,58cbe0a7-360a-45a0-bbeb-9fe5825b80b5,nob,2000,Etterevaluering,Konstitusjonelle organer ,Dokument,Nr. 1 (2000-2001),Dokumentstudier,,,,,,371047
Evaluering av endringer i kjøpsavgiften for nye biler fra 2006-2011,,Evaluering,590067ed-151b-481e-8480-50c64f8ead2a,nob,2013,Samfunnsøkonomisk analyse,Økonomi,Rapport,42/2012,Statistikk,,,,,Økonometrisk analyse,237855
Utdanning blant styrere og pedagogiske ledere i barnehager,,Evaluering,59132581-f013-410a-9e76-1c616e586e02,nob,2007,Tidsuavhengig evaluering,Utdanning og forskning,Prosjektrapport,aug.07,Spørreskjema,,,,,,NULL
Forslag til endring i planloven,,Evaluering,5915a0a0-6dde-4574-83d8-bcd9582bd435,nob,2007,Forhåndsevaluering,Offentlig forvaltning,ECON-notat,2007-023,Dokumentstudier,,,,,,21216
Et trappetrinn opp i livet,https://www.fafo.no/zoo-publikasjoner/fafo-rapporter/et-trappetrinn-opp-i-livet,Ukategorisert,593da2b4-f16a-433a-9711-bc7fef6ef2a3,nob,2008,Etterevaluering,Arbeid og velferd,Fafo-rapport,28/2008,Intervju,Spørreskjema,Dokumentstudier,,,,286362
Frivillige kommunesammenslutninger 2005-2008,https://www.regjeringen.no/no/dokumenter/frivillige-kommunesammenslutninger-2005-/id590119/,Ukategorisert,595207be-941a-43e2-acbe-89f69c1c5120,nob,2010,Etterevaluering,Offentlig forvaltning,TF-rapport,258/2009,Intervju,Spørreskjema,Dokumentstudier,Statistikk,,"Intervju med strategisk valgte personer i kommunene, og telefonintervju med representativt utvalg blant innbyggerne i alle kommunene.",296440
"The Making of UNHCR´s Guidance and it's Implementation in the National Jurisdiction of The United Kingdom, Norway and Sweden",,Evaluering,5960c0ed-4580-479d-bae9-7cc876ffae6a,eng,2010,Tidsuavhengig evaluering,Innvandring og inkludering,,,Intervju,Dokumentstudier,,,,,384257
Konseptvalgutredning E6 Mørsvikbotn - Ballangen,,KVU/KS1/KS2,5986608a-4876-4664-924e-4acd0c2b9bc5,nob,2012,Forhåndsevaluering,Transport og kommunikasjon,,,Dokumentstudier,Statistikk,Observasjon,,,,84557
Verdiskaping på tvers,,Evaluering,59979c0c-d4e3-431b-afe5-34ddc74b5601,nob,2010,Underveisevaluering,"Kultur, fritid og livssyn",NF-rapport,mai.10,Intervju,Dokumentstudier,,,,,86790
Evaluering av Innovasjon Norge,,Evaluering,59996e9a-400c-4b9f-9706-6cf1ef7b878a,nob,2010,Underveisevaluering,Offentlig forvaltning,Econ-rapport,2010-054,Intervju,Spørreskjema,Dokumentstudier,,,,782329
Resultatmåling av brukerstyrt forskning 2010,,Evaluering,599df98e-4f0f-4c66-9f71-c4267d198693,nob,2012,Underveisevaluering,Utdanning og forskning,Rapport / Møreforsking Molde,1204,,,,,,,244716
Produksjonsreguleringer i havbruk : tilleggsutredning,,Evaluering,59c64074-fcc8-4867-a524-9f80be7978dc,nob,2013,Samfunnsøkonomisk analyse,"Mat, fisk og landbruk",,,,,,,,Utredningen er basert på 6 ulike scenarier definert av Kontali Analyse og SINTEF Fisker og Havbruk i fellesskap. Kontali Analyse AS sine produksjonsmodeller er grunnlag for scenariene.,126245
Riksrevisjonens oppfølging av forvaltningsrevisjoner som er behandlet av Stortinget,,Riksrevisjonsrapport,59ce4969-ce74-434a-85b6-2f45419c2cda,nob,2013,Etterevaluering,Konstitusjonelle organer ,Dokument,3:1 (2013&ndash;2014),Dokumentstudier,,,,,,138060
Riksrevisjonens undersøkelse vedrørende resultatoppnåelse i Arbeidstilsynet,,Riksrevisjonsrapport,59cfc142-47c2-40f8-9718-f3188bf54491,nob,2000,Tidsuavhengig evaluering,Konstitusjonelle organer ,Dokument,nr. 3:9 (1999-2000),Intervju,Dokumentstudier,Statistikk,,,,113343
Arbeidsrapport nr. 2 fra forskerprosjektet VRI-Nordland,,Evaluering,59d2ab20-9db3-451f-bdba-7bc3a009a80b,nob,2011,Underveisevaluering,Utdanning og forskning,NF-rapport,okt.11,Dokumentstudier,,,,,,215613
Evaluering av midtmarkering på veg,,Evaluering,59d6424d-ee4e-4810-8694-746f0dbc8ab0,nob,2007,Etterevaluering,Transport og kommunikasjon,Rapport IRIS,2007/155,Spørreskjema,Observasjon,,,,,76944
Evaluering av SMARTRANS-programmet,,Evaluering,59f10fb1-b473-477a-94bd-ca18435ab9ac,nob,2014,Etterevaluering,Utdanning og forskning,Rapport,2014:25:00,Intervju,Spørreskjema,Dokumentstudier,Statistikk,,"Gjennomgang av relevante dokumenter, innsamling og bearbeiding av statistikk fra Forskningsrådet, dybdeintervjuer med utvalgte aktører og en gjennomgang av et utvalg av de prosjekter som er finansiert i SMARTRANS",359225
Effekter av tvangsreturer for assistert retur,,Evaluering,5a0067c8-2790-4f18-981e-c9c1141c52d5,nob,2016,Underveisevaluering,Innvandring og inkludering,,,Statistikk,,,,,,201612
Evaluering av NCE-programmet,,Evaluering,5a1dc97f-6764-4855-b102-95ad085802ec,nob,2011,Underveisevaluering,Næringsliv,Econ-rapport,R-2011-036,Intervju,Dokumentstudier,Statistikk,,,,176588
Årsaker til økt tilstrømming til uføretrygd blant unge : Delrapport,,Evaluering,5a2d2298-802c-4425-88f1-6aac1ac87bdd,nob,2019,Tidsuavhengig evaluering,Arbeid og velferd,,,Dokumentstudier,,,,,Litteraturgjennomgang,132909
Kartlegging av kostnadsgrunnlaget for passasjeravgiftene ved Avinors lufthavner,,Evaluering,5a2de614-22f0-4ebc-a465-0119926f0f75,nob,2010,Samfunnsøkonomisk analyse,Transport og kommunikasjon,TØI-rapport,1100,Intervju,Dokumentstudier,,,,,99636
"A trusted facilitator: An evaluation of Norwegian engagement in the peace process between the Colombian Government and the FARC, 2010–2016",,Evaluering,5a2faf39-db68-4824-88a6-3081e80e6319,eng,2018,Etterevaluering,Internasjonalt,,,Intervju,Dokumentstudier,Statistikk,,,,284563
Pappa i fengsel: andre evalueringsrapport,,Evaluering,5a4573dc-fbe2-43b6-8e91-fe21d3f5785f,nob,2013,Underveisevaluering,Lov og rett,Oppdragsrapport,2013:18:00,Intervju,,,,,Personlig intervju,153087
Housing first i Norge,,Evaluering,5a73cf50-a9bf-43a8-8cd2-1b5bdba51e68,nob,2014,Tidsuavhengig evaluering,Bolig og eiendom,Fafo-rapport,2015:52:00,Intervju,Dokumentstudier,,,,,143210
Riksrevisjonens undersøkelse av toll-og avgiftsetatens virksomhetskontroll,,Riksrevisjonsrapport,5a7e3a3b-d722-4314-84f4-39424ea86701,nob,2004,Tidsuavhengig evaluering,Konstitusjonelle organer ,Dokument,3:7 (2003-2004),Intervju,Dokumentstudier,Statistikk,Observasjon,,,146913
22.jul.11,,Evaluering,5a943c6d-e031-4d06-a294-88386e6fb789,nob,2012,Etterevaluering,Lov og rett,POD-publikasjon,mar.12,Intervju,Spørreskjema,Dokumentstudier,Observasjon,,Kvantitative og kvalitative metoder,397565
Midterm evaluation of  FORINNPOL centres 2020,,Evaluering,5a9fe2b8-871f-4020-a41b-2a59c8568ea4,eng,2021,Underveisevaluering,Utdanning og forskning,,,Intervju,Dokumentstudier,,,,,70586
"Utfordringer innen kompetanse, opplæring og utvikling i duodji",,Evaluering,5aa20ac3-5491-4347-9fad-5adc249d33f3,nob,2008,Underveisevaluering,Utdanning og forskning,,,Intervju,Dokumentstudier,,,,,88853
Spørreundersøkelse om bruk av telefoni og Internett blant døve og hørselshemmede,,Evaluering,5ae436e0-d84c-4e11-89ee-b747beaffd9b,nob,2012,Tidsuavhengig evaluering,Transport og kommunikasjon,,,Spørreskjema,,,,,,114456
Riksrevisjonens undersøkelse av bærekraftig forvaltning av norske skogressurser,,Riksrevisjonsrapport,5ae5a151-ef6a-4653-96a7-ce9452c38b69,nob,2012,Etterevaluering,Konstitusjonelle organer ,Dokument,3:17 (2012-2013),Spørreskjema,Dokumentstudier,Statistikk,,,,315051
Vurdering av årsaker og medvirkende faktorer som kan resultere i akutt utslipp til sjø fra petroleumsvirksomhet i Nordsjøen og Skagerrak,,Evaluering,5ae85aed-5ce3-46bb-92cc-8e31ec0e0e74,nob,2012,Underveisevaluering,Offentlig forvaltning,,,Dokumentstudier,Statistikk,Observasjon,,,Metoden er utviklet i Ptil i samarbeid med konsulent og baserer seg på prinsippene Norsk Standard for Risikostyring - Prinsipper og retningslinjer,345582
Kan havørn begrense konflikter mellom ærfugl og blåskjelldyrking?,,Evaluering,5af230bd-6f0d-4e51-b7b5-d31ec9aa25bc,nob,2007,Etterevaluering,Miljø,NINA rapport,279,Observasjon,,,,,,25536
Anskaffelser av arbeidsmarkedstjenester,,Evaluering,5af3b978-eceb-4b0f-8aaf-750ea532163f,nob,2010,Etterevaluering,Arbeid og velferd,Econ-rapport,R-2010-089,Intervju,Spørreskjema,Dokumentstudier,Statistikk,,,279384
Brukerevaluering for operatører på kommunikasjonssentraler i Nødnett-utbyggingens trinn 1,,Evaluering,5afdf3d5-b273-470c-b483-b77e6a0396ae,nob,2010,Underveisevaluering,Offentlig forvaltning,,,Intervju,Dokumentstudier,,,,,86238
Riksrevisjonens undersøkelse av klagesaksbehandlingen ved fylkesmannsembetene,,Riksrevisjonsrapport,5b147948-5446-4020-a915-8948a807f460,nob,2001,Tidsuavhengig evaluering,Konstitusjonelle organer ,Dokument,3:12 (2000-2001),Intervju,Dokumentstudier,Statistikk,,,,137134
Evaluering av videreutdanning i psykisk helsearbeid,,Evaluering,5b1e37ba-2d46-4fcd-b75c-ff19fbcb3b96,nob,2007,Tidsuavhengig evaluering,Helse og omsorg,SINTEF rapport,A2954,Intervju,Spørreskjema,Dokumentstudier,,,,175206
Kartlegging av lærere uten formelle kvalifikasjoner,,Evaluering,5b205f22-8b09-4230-aaa7-4766a368c6fe,nob,2016,Tidsuavhengig evaluering,Utdanning og forskning,Rapport,2016:15:00,Intervju,Spørreskjema,Dokumentstudier,Statistikk,,Kvalitativ og kvantitativ metode,325046
